response;title;year;rated;released;runtime;genre;director;writer;actors;plot;language;country;awards;poster;metascore;imdbRating;imdbVotes;imdbID;type;season;episode;seriesID
True;#DUPE#;2003;N/A;04 May 2003;128 min;Biography, Comedy, Drama;Glenn Jordan;Katie Ford, T.S. Cook;Rachel York, Danny Pino, Ann Dowd, LaChanze;MOW about the life of Lucille Ball, focusing on the loving yet tumultuous relationship with Desi Arnaz.;English;USA;N/A;N/A;N/A;6,5;534;tt0361856;movie;;;
True;America's Next Top Model;2003–;TV-PG;20 May 2003;42 min;Game-Show, Reality-TV;N/A;Tyra Banks, Kenya Barris, Ken Mok;Tyra Banks, J. Alexander, Jay Manuel, Nigel Barker;"A cyclical competition where women from all over the U.S. compete for the honor of being America's next &quot;it girl&quot; in the modeling world.";English;USA;5 wins & 31 nominations.;http://ia.media-imdb.com/images/M/MV5BMTg0ODc2MjAzNV5BMl5BanBnXkFtZTgwNzIwNDgzNjE@._V1_SX300.jpg;N/A;5,5;15,379;tt0363307;series;;;
True;#DUPE#;2003;UNRATED;12 Sep 2003;74 min;Documentary;Kim Bartley, Donnacha O'Briain;N/A;Hugo Chávez, Pedro Carmona, Jesse Helms, Colin Powell;In April 2002, an Irish film crew is making a documentary about Venezuelan President Hugo Chavez, when a coup from the opposition is made.;English, Spanish;Ireland, Netherlands, USA, Germany, Finland, UK;13 wins & 3 nominations.;N/A;81;8,4;2,016;tt0363510;movie;;;
True;Finding John Christmas;2003;PG;30 Nov 2003;91 min;Drama, Family, Fantasy;Andy Wolk;Michael J. Murray;Valerie Bertinelli, William Russ, David Cubitt, Jennifer Pisana;Max, the Christmas angel, returns in a new story as he attempts to reunite a fallen hero with his family and bring dreams back into the life of a nurse struggling to save her E.R. from being closed.;English;USA;N/A;N/A;N/A;6,5;508;tt0365390;movie;;;
True;The Matador;2005;R;27 Jan 2006;96 min;Comedy, Crime, Drama;Richard Shepard;Richard Shepard;Pierce Brosnan, Arlin Miller, Azucena Medina, Jonah Meyerson;A globetrotting hitman and a crestfallen businessman meet in a hotel bar in Mexico City in an encounter that draws them together in a way neither expected.;English, Spanish;USA, Germany, Ireland;Nominated for 1 Golden Globe. Another 1 win & 5 nominations.;http://ia.media-imdb.com/images/M/MV5BMTIwNjE3MzgwM15BMl5BanBnXkFtZTcwMzk5OTQzMQ@@._V1_SX300.jpg;65;6,8;40,100;tt0365485;movie;;;
True;Moon Child;2003;N/A;19 Apr 2003;120 min;Action, Drama, Sci-Fi;Takahisa Zeze;Gackt, Takahisa Zeze, Kishû Izuchi;Hyde, Gackt, Leehom Wang, Tarô Yamamoto;The story of love and friendship on the harsh streets of 2014 Mallepa, a small corner in Asia.;Cantonese, Japanese, Mandarin, English;Japan;1 win.;http://ia.media-imdb.com/images/M/MV5BMTQ3MjI1ODQwOF5BMl5BanBnXkFtZTcwMDE3OTYyMQ@@._V1_SX300.jpg;N/A;6,6;1,741;tt0365514;movie;;;
True;Illusive Tracks;2003;N/A;25 Dec 2003;100 min;Comedy, Thriller;Peter Dalle;Peter Dalle;Gustaf Hammarsten, Magnus Roosmann, Anna Björk, Kristina Törnqvist;"On a train in 1945 a train conductor is in charge of a motley bunch: a failed author who means well but creates chaos; a soldier who is actually on the wrong train; a doctor who wants to ...";Swedish;Sweden;4 wins & 2 nominations.;http://ia.media-imdb.com/images/M/MV5BMTQ2NDY2OTU3OV5BMl5BanBnXkFtZTcwNzg0NDMzMQ@@._V1_SX300.jpg;N/A;6,9;2,216;tt0365763;movie;;;
True;Kerching!;2003–2006;N/A;06 Jan 2003;N/A;Comedy, Family;N/A;N/A;Devon Anderson, Tendayi Jembere, Jamie Sweeney, Tisha Martin;Children's comedy drama series about the adventures of teenage wheeler-dealer Taj Lewis.;English;UK;N/A;N/A;N/A;6;141;tt0366043;series;;;
True;Breaking Dawn;2004;R;16 Oct 2004;87 min;Horror, Mystery, Thriller;Mark Edwin Robinson;Mark Edwin Robinson;Kelly Overton, James Haven, Jennette McCurdy, Joe Morton;A dedicated young medical student is assigned to probe into the mind of Don Wake, a patient at a psychiatric hospital loaded with secrets. She pushes him to reveal the truth about the ...;English;USA;N/A;http://ia.media-imdb.com/images/M/MV5BMTYwMTU4MDMzNF5BMl5BanBnXkFtZTcwNTc3ODE1MQ@@._V1_SX300.jpg;N/A;5,7;1,390;tt0366518;movie;;;
True;The Soul of a Man;2003;N/A;06 May 2004;103 min;Documentary, Biography, History;Wim Wenders;Wim Wenders;Chris Thomas King, Keith B. Brown, James Hughes, David F. Hughes;N/A;English;Germany, USA;Won 1 Primetime Emmy. Another 1 win & 1 nomination.;http://ia.media-imdb.com/images/M/MV5BMTg4NTE5Mzc5Nl5BMl5BanBnXkFtZTcwODIyNTkyMQ@@._V1_SX300.jpg;N/A;7,5;686;tt0368287;movie;;;
True;Separate Lies;2005;R;18 Nov 2005;85 min;Drama, Romance, Thriller;Julian Fellowes;"Nigel Balchin (based on the novel by &quot;A Way Through the Wood&quot;), Julian Fellowes";Tom Wilkinson, Emily Watson, Hermione Norris, John Warnaby;A couple's marriage is complicated by the introduction of a third party.;English, French;UK;1 win & 5 nominations.;http://ia.media-imdb.com/images/M/MV5BMTIwMDE5NDcwMV5BMl5BanBnXkFtZTcwNjY0MjEzMQ@@._V1_SX300.jpg;71;6,5;3,564;tt0369053;movie;;;
True;Stripperella;2003–;TV-MA;26 Jun 2003;30 min;Animation, Comedy, Action;N/A;Kevin Kopelow, Stan Lee, Heath Seifert;Pamela Anderson, Tom Kenny, Maurice LaMarche, Jill Talley;Pamela Anderson provides the voice of Erotica Jones who is stripper by night and superhero Stripperella by even later at night.;English;USA;N/A;http://ia.media-imdb.com/images/M/MV5BMTM3OTExNTAwOF5BMl5BanBnXkFtZTcwMDIwMDgyMQ@@._V1_SX300.jpg;N/A;5,7;935;tt0369171;series;;;
True;Walking with Cavemen;2003–;N/A;27 Mar 2003;100 min;Documentary, History;N/A;N/A;Robert Winston, Alec Baldwin, Christian Bradley, Alex Palmer;The great follow-up to 'Walking with Dinosaurs' and 'Walking with Beasts', presented by Professor Robert Winston, explains the story of human evolution.;English;UK;N/A;http://ia.media-imdb.com/images/M/MV5BMTM2NTkyOTMxMV5BMl5BanBnXkFtZTcwNDk1NDEyMQ@@._V1_SX300.jpg;N/A;7,7;875;tt0370053;series;;;
True;9 Souls;2003;N/A;19 Jul 2003;120 min;Drama;Toshiaki Toyoda;Toshiaki Toyoda;Yoshio Harada, Ryûhei Matsuda, Genta Dairaku, Eita;"Nine convicts escape from prison; most are convicted murders. They commandeer a van from a strip club. Their plan is to find a stash of counterfeit money that a deranged cell mate told them...";Japanese;Japan;1 nomination.;http://ia.media-imdb.com/images/M/MV5BMTI0NTQ4NTUxN15BMl5BanBnXkFtZTcwNzA5NTcyMQ@@._V1_SX300.jpg;N/A;7,4;1,302;tt0370244;movie;;;
True;Arachnia;2003;R;05 Aug 2003;82 min;Horror, Sci-Fi;Brett Piper;Brett Piper;Rob Monkiewicz, Irene Joseph, David Bunce, Bevin McGraw;When a small research plain carrying a group of science students and their professor crash-lands in the middle of nowhere, the survivors go to a nearby farmhouse to look for help but soon find themselves besieged by giant mutant spiders.;English;USA;N/A;http://ia.media-imdb.com/images/M/MV5BMTM5MjY4NzY1Nl5BMl5BanBnXkFtZTcwMTUxNTAzMQ@@._V1_SX300.jpg;N/A;3,7;583;tt0370295;movie;;;
True;Sword in the Moon;2003;N/A;16 Jul 2003;102 min;Action, Drama, Adventure;Ui-seok Kim;Min-seok Jang;Min-su Choi, Jae-hyeon Jo, Bo-kyeong Kim, Jong-su Lee;N/A;Korean;South Korea;N/A;http://ia.media-imdb.com/images/M/MV5BMzc5OTMxODI0N15BMl5BanBnXkFtZTgwNTE5MjU0MTE@._V1_SX300.jpg;N/A;5,9;1,241;tt0370402;movie;;;
True;#DUPE#;1997–2007;TV-14;27 Jul 1997;44 min;Action, Adventure, Drama;N/A;Jonathan Glassner, Brad Wright;Amanda Tapping, Christopher Judge, Michael Shanks, Richard Dean Anderson;A secret military team, SG-1, is formed to explore the recently discovered Stargates.;English;USA, Canada;Nominated for 9 Primetime Emmys. Another 18 wins & 88 nominations.;http://ia.media-imdb.com/images/M/MV5BMTc3MjEwMTc5N15BMl5BanBnXkFtZTcwNzQ2NjQ4NA@@._V1_SX300.jpg;N/A;8,4;57,337;tt0118480;series;;;
True;Terrorists: The Kids They Sentenced;2003;N/A;11 Dec 2009;85 min;Documentary;Stefan Jarl, Lukas Moodysson;Stefan Jarl, Lukas Moodysson;Stefan Jarl, Lukas Moodysson;A feature-length documentary, possibly focusing, at least in part, on the recent anti-globalisation protests in Gothenburg, Sweden and the alleged police misconduct during the protests. The...;Swedish;Sweden;N/A;N/A;N/A;6,5;407;tt0374272;movie;;;
True;Che: Part Two;2008;NOT RATED;24 Jan 2009;135 min;Biography, Drama, History;Steven Soderbergh;Peter Buchman (screenplay), Benjamin A. van der Veen (screenplay), Ernesto 'Che' Guevara (Bolivian Diary);Demián Bichir, Rodrigo Santoro, Benicio Del Toro, Catalina Sandino Moreno;In 1967, Ernesto 'Che' Guevara leads a small partisan army to fight an ill-fated revolutionary guerrilla war in Bolivia, South America.;Spanish, English;Spain, France, USA;2 wins & 6 nominations.;http://ia.media-imdb.com/images/M/MV5BNjI5NDY3MzYxMV5BMl5BanBnXkFtZTcwNTYwMDU5Mg@@._V1_SX300.jpg;64;6,9;26,831;tt0374569;movie;;;
True;Gun Crazy: Episode 1 - A Woman from Nowhere;2002;N/A;23 Aug 2002;N/A;Action, Crime, Drama;Atsushi Muroga;Takeshi Hamazaki, Atsushi Muroga;Ryôko Yonekura, Shingo Tsurumi, Takeshi Yamato, Shun Sugata;N/A;Japanese;Japan;N/A;http://ia.media-imdb.com/images/M/MV5BMjEwOTg3NDY5MF5BMl5BanBnXkFtZTcwOTgyNTYyMQ@@._V1_SX300.jpg;N/A;6,1;105;tt0374688;movie;;;
True;Art Heist;2004;R;22 Mar 2005;98 min;Action, Crime, Thriller;Bryan Goeres;Diane Fine, Evan Spiliotopoulos;Ellen Pompeo, William Baldwin, Abel Folk, Simón Andreu;When a painting owned by one of her clients is stolen from a Barcelona museum, a New York-based artexpert is sent there to help investigate. After more paintings are stolen, she learns that...;English, Spanish, Russian;Spain, USA;N/A;http://ia.media-imdb.com/images/M/MV5BMTI5OTY4OTIwMV5BMl5BanBnXkFtZTcwODIwMjUyMQ@@._V1_SX300.jpg;N/A;4,3;707;tt0375560;movie;;;
True;Some Things That Stay;2004;N/A;20 Mar 2007;96 min;Drama, Romance;Gail Harvey;Catherine Gourdier, Sarah Willis (novel);Katie Boland, Stuart Wilson, Alberta Watson, Geraint Wyn Davies;A coming-of-age story of a teenage girl from a liberal upbringing who moves to a conservative baptist community in rural 1950s America.;English;Canada, UK;2 nominations.;http://ia.media-imdb.com/images/M/MV5BMTY4MjMyMDA3Ml5BMl5BanBnXkFtZTcwNjUxODcyMQ@@._V1_SX300.jpg;N/A;6,2;295;tt0378786;movie;;;
True;Blood of the Werewolf;2001;UNRATED;N/A;82 min;Horror;Joe Bagnardi, Bruce G. Hallenbeck, Kevin J. Lindenmuth;Stephen C. Seward;Joe Bagnardi, Dan Bailey, Helen Black, Mia Borrelli;N/A;English;USA;N/A;http://ia.media-imdb.com/images/M/MV5BMjQzMDAzOTA2Ml5BMl5BanBnXkFtZTcwODg2NzQyMQ@@._V1_SX300.jpg;N/A;3,3;39;tt0379186;movie;;;
True;Seizing Me;2003;N/A;28 Nov 2003;92 min;Thriller;Halfdan Hussey;Halfdan Hussey, Jeffrey Vargas;Lisa Keller, Howard Antony, Kathy Garver, Bob Rumnock;She takes body, mind, & soul.;English;USA;N/A;http://ia.media-imdb.com/images/M/MV5BMjExNjY2MTY1MV5BMl5BanBnXkFtZTgwNjAxMDA2MDE@._V1_SX300.jpg;N/A;6;51;tt0379489;movie;;;
True;Team Sanchez;2002–;TV-MA;11 Mar 2005;30 min;Action, Comedy, Reality-TV;N/A;N/A;Matthew Pritchard, Dan Joyce, Lee Dainton, Mike Locke;An extreme version of Jackass. From naked paintballing to ear stapling Pritchard, Dainton, Joyce and Pancho will go to any lengths to cause serious damage to themselves and each other.;English;UK;N/A;http://ia.media-imdb.com/images/M/MV5BMjE1MTgwNTQ4MV5BMl5BanBnXkFtZTcwMDQ2MjcyMQ@@._V1_SX300.jpg;N/A;6,7;1,401;tt0380105;series;;;
True;Back in the Day;2005;R;03 Nov 2005;103 min;Action, Crime, Drama;James Hunter;James Hunter, Michael Raffanello;Joe Morton, Ja Rule, Norman Grant, Ving Rhames;In BACK IN THE DAY, Reggie Cooper, a young man from the rough side of the tracks who lives with his divorced, affluent father in order to avoid the gang activity that almost claimed his ...;English;USA;N/A;http://ia.media-imdb.com/images/M/MV5BMTIwODUxOTYyN15BMl5BanBnXkFtZTcwNjY2ODkyMQ@@._V1_SX300.jpg;N/A;4,5;592;tt0380201;movie;;;
True;Creep;2004;R;28 Jan 2005;85 min;Horror, Mystery, Thriller;Christopher Smith;Christopher Smith;Vas Blackwood, Ken Campbell, Kathryn Gilfeather, Franka Potente;Trapped in a London subway station, a woman who's being pursued by a potential attacker heads into the unknown labyrinth of tunnels beneath the city's streets.;English, German;UK, Germany;N/A;http://ia.media-imdb.com/images/M/MV5BNTgzODgyOTQ3OF5BMl5BanBnXkFtZTcwMjI0MjgyMQ@@._V1_SX300.jpg;N/A;5,6;23,136;tt0381966;movie;;;
True;Bet Your Life;2004;TV-14;04 Aug 2004;120 min;Action;Louis Morneau;Jeff Welch (story), Jeff Welch (teleplay), Louis Morneau (teleplay);Sean Carrigan, Corinne Van Ryck de Groot, Billy Zane, Richard Pierre-Louis;A man [Sean] makes a bet in Las Vegas with some men who want to kill him. He bets he can stay alive for 24 hours, then comes to Cleveland to elude them.;English;USA;N/A;http://ia.media-imdb.com/images/M/MV5BOTk1MzUyMjU3NV5BMl5BanBnXkFtZTcwNzkwMTY2MQ@@._V1_SX300.jpg;N/A;4,6;632;tt0381980;movie;;;
True;Behind Bedroom Doors;2003;R;16 Sep 2003;88 min;Drama;N/A;Denise Monroe (screenplay);Nicole Sheridan, Chelsea Blue, Richard Lounello, Julia Kruis;New-girl-in-town Abby is already dating two guys--one's a doctor, the other is running for district attorney...;English;USA;N/A;N/A;N/A;3,8;118;tt0383210;movie;;;
True;#DUPE#;2002–2005;TV-PG;17 Sep 2002;30 min;Comedy, Drama;N/A;Tracy Gamble;Katey Sagal, Kaley Cuoco-Sweeting, Amy Davidson, Martin Spanjers;The Hennessy clan -- mother Cate, daughters Bridget and Kerry, and son Rory -- look to one another for guidance and support after the death of Paul, the family patriarch. Cate's parents lend a hand.;English;USA;Won 1 Primetime Emmy. Another 8 wins & 12 nominations.;http://ia.media-imdb.com/images/M/MV5BMTI3MTk4Mjk1NV5BMl5BanBnXkFtZTcwMjU0ODM1MQ@@._V1_SX300.jpg;N/A;7,1;19,428;tt0312081;series;;;
True;Admissions;2004;PG;06 Jun 2006;N/A;Drama;Melissa Painter;Dawn O'Leary (screenplay);Lauren Ambrose, Amy Madigan, Christopher Lloyd, Fran Kranz;The Brighton has a traumatic drama in the breast of their family: the twenty years old Emily Brighton is intellectually disabled due to a fall when she was one, and her overprotective ...;English;USA;N/A;http://ia.media-imdb.com/images/M/MV5BMTU5NzgzODMyNF5BMl5BanBnXkFtZTcwMTg4MTkyMQ@@._V1_SX300.jpg;N/A;6,3;256;tt0384212;movie;;;
True;#DUPE#;2005;UNRATED;03 Apr 2005;90 min;Adventure, Comedy, Sci-Fi;Bruce Campbell;Bruce Campbell, Bruce Campbell (story), David M. Goodman (story), Sam Raimi (story);Bruce Campbell, Tamara Gorski, Ted Raimi, Antoinette Byron;The brains of a Russian taxi driver and a wealthy businessman are brought together in one body by a mad scientist.;English;Germany, USA;1 nomination.;http://ia.media-imdb.com/images/M/MV5BMTMxNzkyODQ4NF5BMl5BanBnXkFtZTcwMTg1MDEzMQ@@._V1_SX300.jpg;N/A;5,6;4,328;tt0365478;movie;;;
True;#DUPE#;2002;R;25 Mar 2003;86 min;Action, Comedy, Drama;Emmanuel Itier;Bill Cunningham, Emmanuel Itier, Jason White, Stephen Wozniak (additional screenwriting);Tim Young, Todd Rex, Tiffany Shepis, Jen Richey;A high school outcast who lives in a trailer with his mother finally meets a friend. He wants to ask her if they can go the next step, but then sees her kissing another boy at a party. He ...;English;USA;N/A;http://ia.media-imdb.com/images/M/MV5BMTIxNTc0ODUwMV5BMl5BanBnXkFtZTcwNjUwMjQyMQ@@._V1_SX300.jpg;N/A;3,5;897;tt0341564;movie;;;
True;Accepted;2006;PG-13;18 Aug 2006;93 min;Comedy;Steve Pink;Adam Cooper (screenplay), Bill Collage (screenplay), Mark Perez (screenplay), Mark Perez (story);Justin Long, Jonah Hill, Adam Herschman, Columbus Short;A high school slacker who's rejected by every school he applies to opts to create his own institution of higher learning, the South Harmon Institute of Technology, on a rundown piece of property near his hometown.;English;USA;4 nominations.;http://ia.media-imdb.com/images/M/MV5BMTkzNzY5OTc3Nl5BMl5BanBnXkFtZTcwNjE4NDQzMQ@@._V1_SX300.jpg;47;6,5;103,205;tt0384793;movie;;;
True;Villa paranoia;2004;N/A;12 Mar 2004;106 min;Drama;Erik Clausen;Erik Clausen;Erik Clausen, Sonja Richter, Frits Helmuth, Lærke Winther Andersen;A satire, psychological drama and comedy rolled into one, director Erik Clausen's Villa Paranoia adeptly draws upon rich characters, who demonstrate the values and strength of the human heart, to create a portrait of Denmark today.;Danish, Serbian;Denmark;4 wins & 6 nominations.;http://ia.media-imdb.com/images/M/MV5BMTEwODQ3NDQ1ODdeQTJeQWpwZ15BbWU4MDQ1MTAwNjAx._V1_SX300.jpg;N/A;6,6;487;tt0386850;movie;;;
True;Okul;2004;N/A;09 Jan 2004;100 min;Comedy, Horror;Durul Taylan, Yagmur Taylan;Dogu Yücel;Deniz Akkaya, Hamdi Alkan, Burak Altay, Serdar Deniz;Adapted from Do?u Yücel's supreme novel, Ghost Book, School takes place in a high school environment. The film revolves around a young group of spoiled teenagers and their struggle to ...;Turkish;Turkey;N/A;http://ia.media-imdb.com/images/M/MV5BMTU2NzM2NzY2MV5BMl5BanBnXkFtZTcwNTU1MDUyMQ@@._V1_SX300.jpg;N/A;4;2,695;tt0387462;movie;;;
True;Deewaar: Let's Bring Our Heroes Home;2004;N/A;25 Jun 2004;N/A;War, Action, Drama;Milan Luthria;Anurag Kashyap (dialogue), Shridhar Raghavan (screenplay);Amitabh Bachchan, Sanjay Dutt, Akshaye Khanna, Amrita Rao;Major Ranvir Kaul (Amitabh Bachchan) is a POW who was captured along with over 30 soldiers by Pakistani soldiers in 1971 during the war between India and Pakistan. 33 years later Ranvir's ...;Hindi;India;2 nominations.;N/A;N/A;6,2;954;tt0387989;movie;;;
True;Red Dust;2004;R;06 May 2005;110 min;Drama;Tom Hooper;Troy Kennedy-Martin (screenplay), Gillian Slovo (novel);Jamie Bartlett, Hilary Swank, Ian Roberts, Chiwetel Ejiofor;Police officer Dirk Hendricks (Bartlett) files an amnesty application for Alex Mpondo (Ejiofor), a member of the South African Parliament who can't remember the torture he once endured as a captive political activist. South African-born attorney Sarah Barcant (Swank), meanwhile, returns to her homeland to represent Mpondo, as well as Steve Sizela, Mpondo's friend who arrested along with him and ...;English, Xhosa, Afrikaans;UK, South Africa;4 wins & 2 nominations.;http://ia.media-imdb.com/images/M/MV5BMTY1NTcyOTEwN15BMl5BanBnXkFtZTcwODQyOTIzMQ@@._V1_SX300.jpg;N/A;6,9;1,866;tt0388364;movie;;;
True;Bobbycrush;2003;N/A;09 Nov 2003;10 min;Short;Cam Archer;Cam Archer;Jasper Bel, Cassidy Field, Jason Jacen, Terri Walker;Bobby Stone is 13 and in love. Problem is that he's in love with his best friend Dylan and Dylan doesn't feel the same way.;English;USA;N/A;N/A;N/A;6,2;118;tt0388784;movie;;;
True;Edison;2005;R;11 Nov 2005;99 min;Action, Crime, Drama;David J. Burke;David J. Burke;Morgan Freeman, Kevin Spacey, Justin Timberlake, LL Cool J;Upon discovering a den of corrupt policemen, a fresh-faced journalist makes a shaky allies in a jaded reporter and investigator for a powerful district attorney.;English;USA, Germany;1 win.;http://ia.media-imdb.com/images/M/MV5BMTc3NDA1MzM3OF5BMl5BanBnXkFtZTcwNjUzNTQzMQ@@._V1_SX300.jpg;N/A;5,3;13,142;tt0389957;movie;;;
True;Finisterre;2003;N/A;23 May 2003;57 min;Documentary;Kieran Evans, Paul Kelly;Kieran Evans, Kevin Pearce, Bob Stanley;Vashti Bunyan, Vic Godard, Andy Hackett, Michael Jayston;London has always been a source of influence, inspiration and curiosity. Paul Kelly and Kieran Evans' FINISTERRE tries to identify the dreams that London holds for so many, and the reality ...;English;UK;N/A;http://ia.media-imdb.com/images/M/MV5BMTQ4OTAxNjQyNl5BMl5BanBnXkFtZTgwMDE0NzcyNDE@._V1_SX300.jpg;N/A;7,4;79;tt0390005;movie;;;
True;Puppet Master: The Legacy;2003;NOT RATED;16 Dec 2003;80 min;Fantasy, Horror, Sci-Fi;Charles Band;C. Courtney Joyner (additional material);Jacob Witkin, Kate Orsini, Ian Abercrombie, Sage Allen;Peter Hertz tells a woman the story of Andre Toulon and his puppets.;English;USA;N/A;http://ia.media-imdb.com/images/M/MV5BMjA3MDU3Mjc2MF5BMl5BanBnXkFtZTcwMDI0NTYzNQ@@._V1_SX300.jpg;N/A;3,3;815;tt0390393;movie;;;
True;Rush in Rio;2003;N/A;21 Oct 2003;171 min;Music, Documentary;Daniel E. Catullo;N/A;Rush, Geddy Lee, Alex Lifeson, Neil Peart;First concert DVD ever from legendary rock trio Rush. Double-DVD set, containing 28 Rush songs. Bonus features include a tour documentary, multi-angle viewing options for certain songs, and...;English, Portuguese;Brazil, USA, Canada;1 nomination.;http://ia.media-imdb.com/images/M/MV5BMjA0OTU5NTEwMF5BMl5BanBnXkFtZTcwMTg3NTcxMQ@@._V1_SX300.jpg;N/A;8,7;635;tt0390441;movie;;;
True;Waqt: The Race Against Time;2005;N/A;22 Apr 2005;153 min;Comedy, Drama, Musical;Vipul Amrutlal Shah;Aatish Kapadia;Amitabh Bachchan, Akshay Kumar, Priyanka Chopra, Shefali Shetty;Wagt the race against time is the story of a father and a son between whom there is a special bond. Ishwarchand Thakur (Amitabh Bachchan) and Sumitra Thakur (Shefali Shah) are a married ...;Hindi;India;4 nominations.;http://ia.media-imdb.com/images/M/MV5BMTUzMzAyMzI0M15BMl5BanBnXkFtZTcwNTc2ODgzMQ@@._V1_SX300.jpg;N/A;7;5,861;tt0390614;movie;;;
True;The Grudge;2004;PG-13;22 Oct 2004;91 min;Fantasy, Horror, Mystery;Takashi Shimizu;"Stephen Susco (screenplay), Takashi Shimizu (film &quot;Ju-On: The Grudge&quot;)";Sarah Michelle Gellar, Jason Behr, William Mapother, Clea DuVall;An American nurse living and working in Tokyo is exposed to a mysterious supernatural curse, one that locks a person in a powerful rage before claiming their life and spreading to another victim.;English, Japanese;USA, Japan;2 wins & 10 nominations.;http://ia.media-imdb.com/images/M/MV5BMjIxODg1Nzc3NF5BMl5BanBnXkFtZTcwMjM0MjEzMw@@._V1_SX300.jpg;49;5,9;111,962;tt0391198;movie;;;
True;I Want Someone to Eat Cheese With;2006;R;28 Apr 2006;80 min;Comedy, Romance;Jeff Garlin;Jeff Garlin;Jeff Garlin, Dan Castellaneta, Mina Kolb, Paul Mazursky;About a man who has trouble with his job, trouble with women, and uses food to deal with it all.;English;USA;N/A;http://ia.media-imdb.com/images/M/MV5BMTY5MTM3Mzk0NF5BMl5BanBnXkFtZTcwMjIyNTI1MQ@@._V1_SX300.jpg;60;6,2;2,922;tt0391229;movie;;;
True;Earth;2007;G;22 Apr 2009;90 min;Documentary;Alastair Fothergill, Mark Linfield;Leslie Megahey, Alastair Fothergill, Mark Linfield;Anggun, James Earl Jones, Patrick Stewart, Ulrich Tukur;Feature-length version of the documentary TV series Planet Earth (2006), following the migration paths of four animal families.;English;UK, Germany, USA;3 wins & 1 nomination.;http://ia.media-imdb.com/images/M/MV5BMTUwMzU5NDk3NF5BMl5BanBnXkFtZTcwOTM4MDUwMg@@._V1_SX300.jpg;72;8;12,719;tt0393597;movie;;;
True;Goin' Down to South Park;1999;N/A;03 May 1999;51 min;Comedy, Documentary;Richard Spiller;N/A;Mary Kay Bergman, Martin Cendreda, Gian Ganziano, Isaac Hayes;A mockumentary which covers the making of the show South Park in a fictional fashion, apparently spoofing similar such shows, with the creators pretending to be arrogant, obnoxious jerks ...;English;UK;N/A;N/A;N/A;7,6;190;tt0394894;movie;;;
True;Maria E as Outras;2004;N/A;29 Apr 2004;100 min;Comedy, Romance;José de Sá Caetano;Rita Benis (screenplay), Possidónio Cachapa (adaptation);Catarina Furtado, Ana Brito e Cunha, Isabel Abreu, São José Lapa;Synopsis Maria, an executive from Oporto, lives in the search of the right man for her. On the other hand, her two friends, Joana, a doctor that has fallen in love to a co-worker, and ...;Portuguese;Portugal;N/A;N/A;N/A;6;79;tt0395365;movie;;;
True;Final Approach;2005;N/A;14 Jan 2005;92 min;Family;James Becket;James Becket;Veronica Alicino, Tom Ayers, Allen Barton, Jordi Caballero;A kid is convinced that the plane he p is riding in is being hijacked.;English;USA;N/A;http://ia.media-imdb.com/images/M/MV5BMTQ3MjE3NDIzM15BMl5BanBnXkFtZTcwMTEzMDU1MQ@@._V1_SX300.jpg;N/A;5,1;300;tt0395616;movie;;;
True;Stella Shorts 1998-2002;2002;NOT RATED;20 Dec 2002;92 min;Comedy;Michael Ian Black, Michael Showalter, David Wain;Michael Ian Black, Michael Showalter, David Wain;Michael Ian Black, Michael Showalter, David Wain, Leo Allen;STELLA is a three-man comedy troupe from New York City, comprised of well-known comedians/actors Michael Showalter, David Wain, and Michael Ian Black. Though the three have made a living ...;English;USA;N/A;N/A;N/A;8,9;472;tt0396880;movie;;;
True;House of Wax;2005;R;06 May 2005;108 min;Horror;Jaume Collet-Serra;Charles Belden (story), Chad Hayes (screenplay), Carey Hayes (screenplay);Elisha Cuthbert, Chad Michael Murray, Brian Van Holt, Paris Hilton;A group of unwitting teens are stranded near a strange wax museum and soon must fight to survive and keep from becoming the next exhibit.;English;Australia, USA;5 wins & 10 nominations.;http://ia.media-imdb.com/images/M/MV5BNDA4Nzg1NjQ2NV5BMl5BanBnXkFtZTcwMDYwNTgyMQ@@._V1_SX300.jpg;41;5,3;92,001;tt0397065;movie;;;
True;King Solomon's Mines;2004;N/A;06 Jun 2004;173 min;Action, Adventure, Fantasy;Steve Boyum;H. Rider Haggard (novel), Steven H. Berman (television story), Steven H. Berman (teleplay), Adam Armus (teleplay), Nora Kay Foster (teleplay);Patrick Swayze, Alison Doody, Roy Marsden, John Standing;An adventurous quest for a treasure hidden in King Solomon's mines, based on H. Rider Haggard's timeless tale.;English;Germany, USA;N/A;http://ia.media-imdb.com/images/M/MV5BNTY3ODM5OTc0NV5BMl5BanBnXkFtZTcwNzMwNDYyMQ@@._V1_SX300.jpg;N/A;6;2,491;tt0397501;movie;;;
True;3 Non-Blondes;2003–;N/A;16 Sep 2003;30 min;Comedy;N/A;N/A;Ninia Benjamin, Tameka Empson, Jocelyn Jee Esien;Gary Reich, the man who started the hidden-camera careers of Sacha Baron Cohen (Da Ali G Show) and Dom Joly (Trigger Happy TV), has found three women to take to the streets and carry the ...;English;UK;3 nominations.;http://ia.media-imdb.com/images/M/MV5BMTI3NTMwMTI0NV5BMl5BanBnXkFtZTcwMzM2OTYyMQ@@._V1_SX300.jpg;N/A;7;108;tt0398408;series;;;
True;Snuff killer - La morte in diretta;2003;N/A;16 Mar 2004;88 min;Horror, Thriller;Bruno Mattei;Bruno Mattei (screenplay), Bruno Mattei (story), Giovanni Paolucci (story);Carla Solaro, Gabriele Gori, Carlo Mucari, Federica Garuti;When the daughter of a politician suddenly disappears, her step-mother investigates the porno industry in search of her.;Italian;Italy;N/A;http://ia.media-imdb.com/images/M/MV5BNDQ3MjIxMDc4N15BMl5BanBnXkFtZTcwNjU2NTA0MQ@@._V1_SX300.jpg;N/A;3,6;196;tt0400837;movie;;;
