response;title;year;rated;released;runtime;genre;director;writer;actors;plot;language;country;awards;poster;metascore;imdbRating;imdbVotes;imdbID;type;season;episode;seriesID
True;Devil Dog: The Hound of Hell;1978;UNRATED;31 Oct 1978;95 min;Thriller, Horror;Curtis Harrington;Steven Karpf, Elinor Karpf;Richard Crenna, Yvette Mimieux, Kim Richards, Ike Eisenmann;A dog that is a minion of Satan terrorizes a suburban family.;English;Canada, USA;N/A;http://ia.media-imdb.com/images/M/MV5BMTk5NDI0NjM5Ml5BMl5BanBnXkFtZTcwMzA5MTgzMQ@@._V1_SX300.jpg;N/A;5,2;753;tt0077429;movie;;;
True;Last Hurrah for Chivalry;1979;N/A;22 Nov 1979;106 min;Action, Drama;John Woo;John Woo;Damian Lau, Pai Wei, Chiu-hua Wei, Kong Lau;A son tries to avenge his father, and gets two sword fighters to help him.;Cantonese;Hong Kong;N/A;http://ia.media-imdb.com/images/M/MV5BNjMwNzEzMjE2MV5BMl5BanBnXkFtZTcwMTgyMjE1MQ@@._V1_SX300.jpg;N/A;7,1;904;tt0077655;movie;;;
True;The One and Only;1978;PG;03 Feb 1978;97 min;Comedy, Romance;Carl Reiner;Steve Gordon;Henry Winkler, Kim Darby, Gene Saks, William Daniels;1951: Andy Schmidt is in his last year of college. Taking life easy and always a saucy joke on his lips, he manages to win fellow student Mary's heart, although she's already otherwise ...;English;USA;N/A;http://ia.media-imdb.com/images/M/MV5BMjA4MzMzMDgyMl5BMl5BanBnXkFtZTcwNDIyNzYyMQ@@._V1_SX300.jpg;N/A;5,8;511;tt0078034;movie;;;
True;The Dick Francis Thriller: The Racing Game;1979–;N/A;08 Apr 1980;309 min;Mystery;N/A;N/A;Mike Gwilym, Mick Ford, James Maxwell, Susan Wooldridge;The cases of a disabled jockey turned private detective specializing in investigations involving horse racing.;English;UK;N/A;http://ia.media-imdb.com/images/M/MV5BMTQyMTk3MTI2MV5BMl5BanBnXkFtZTcwOTQwMzkxMQ@@._V1_SX300.jpg;N/A;7,1;43;tt0078675;series;;;
True;Apocalypse Now;1979;R;15 Aug 1979;153 min;Drama, War;Francis Ford Coppola;John Milius, Francis Ford Coppola, Michael Herr (narration);Marlon Brando, Martin Sheen, Robert Duvall, Frederic Forrest;During the Vietnam War, Captain Willard is sent on a dangerous mission into Cambodia to assassinate a renegade colonel who has set himself up as a god among a local tribe.;English, French, Vietnamese;USA;Won 2 Oscars. Another 18 wins & 32 nominations.;http://ia.media-imdb.com/images/M/MV5BMTcyMzQ5NDM4OV5BMl5BanBnXkFtZTcwODUwNDg3OA@@._V1_SX300.jpg;90;8,5;435,120;tt0078788;movie;;;
True;Birth of the Beatles;1979;N/A;23 Nov 1979;104 min;Biography, Drama, Music;Richard Marquand;John Kurland (teleplay), Jacob Eskendar (teleplay), John Kurland (story);Stephen MacKenna, Rod Culbertson, John Altman, Ray Ashcroft;An account of The Beatles during the Hamburg years, their signing with Brian Epstein and their inevitable rise during the early sixties.;English;USA;N/A;http://ia.media-imdb.com/images/M/MV5BMTM1NDgwODUxOF5BMl5BanBnXkFtZTcwNDQwNzYyMQ@@._V1_SX300.jpg;N/A;6,6;454;tt0078865;movie;;;
True;C.H.O.M.P.S.;1979;PG;21 Dec 1979;89 min;Comedy, Family, Sci-Fi;Don Chaffey;Dick Robbins (screenplay), Duane Poole (screenplay), Joseph Barbera (screenplay), Joseph Barbera (story);Wesley Eure, Valerie Bertinelli, Conrad Bain, Chuck McCann;A young man invents a robot dog that has super strength, x-ray vision and can detect crimes being committed. A greedy businessman tries to steal the invention from him.;English;USA;N/A;http://ia.media-imdb.com/images/M/MV5BODE5OTY2MzY2NF5BMl5BanBnXkFtZTcwMjE5NzgyMQ@@._V1_SX300.jpg;N/A;4,7;581;tt0078924;movie;;;
True;HealtH;1980;PG;12 Sep 1980;105 min;Comedy;Robert Altman;Robert Altman, Frank Barhydt, Paul Dooley;Carol Burnett, Glenda Jackson, James Garner, Lauren Bacall;A parody and satire of the U.S. political scene of the time, HealtH is set at a health food convention at a Florida luxury hotel, where a powerful political organization is deciding on a new president.;English;USA;N/A;N/A;N/A;5,7;497;tt0079256;movie;;;
True;Hair;1979;PG;09 May 1979;121 min;Comedy, Drama, Musical;Milos Forman;Gerome Ragni (musical book), James Rado (musical book), Michael Weller;John Savage, Treat Williams, Beverly D'Angelo, Annie Golden;Claude leaves the family ranch in Oklahoma for New York where he is rapidly indoctrinated into the youth subculture and subsequently drafted.;English;USA, West Germany;Nominated for 2 Golden Globes. Another 2 wins & 2 nominations.;http://ia.media-imdb.com/images/M/MV5BODUzNjUzNzIzM15BMl5BanBnXkFtZTcwMjc4MjkzNA@@._V1_SX300.jpg;68;7,6;26,276;tt0079261;movie;;;
True;The Jericho Mile;1979;N/A;18 Mar 1979;97 min;Crime, Drama, Sport;Michael Mann;Patrick J. Nolan (story), Patrick J. Nolan (teleplay), Michael Mann (teleplay);Peter Strauss, Richard Lawson, Roger E. Mosley, Brian Dennehy;Rain Murphy is a man sentenced to life in prison, choosing to do his time in near-isolation, and engages in distance running when given the opportunity for free-time. While his form and ...;English;USA;Won 3 Primetime Emmys. Another 2 wins & 1 nomination.;http://ia.media-imdb.com/images/M/MV5BMTkxMDQzNzM2OV5BMl5BanBnXkFtZTcwOTc0NDQzMQ@@._V1_SX300.jpg;N/A;7,5;992;tt0079366;movie;;;
True;The Muppet Movie;1979;G;22 Jun 1979;95 min;Adventure, Comedy, Family;James Frawley;Jack Burns, Jerry Juhl;Jim Henson, Frank Oz, Jerry Nelson, Richard Hunt;Kermit and his new found friends trek across America to find success in Hollywood, but a frog-legs merchant is after Kermit.;English;UK, USA;Nominated for 2 Oscars. Another 3 wins & 9 nominations.;http://ia.media-imdb.com/images/M/MV5BMTgzOTg2MTM3M15BMl5BanBnXkFtZTcwMzgxMzEzMQ@@._V1_SX300.jpg;69;7,7;24,870;tt0079588;movie;;;
True;Rock 'n' Roll High School;1979;PG;24 Aug 1979;93 min;Comedy, Music;Allan Arkush, Joe Dante;Richard Whitley (screenplay), Russ Dvonch (screenplay), Joseph McBride (screenplay), Allan Arkush (story), Joe Dante (story);P.J. Soles, Vincent Van Patten, Clint Howard, Dey Young;A group of rock-music-loving students, with the help of the Ramones, take over their school to combat its newly installed oppressive administration.;English;USA;N/A;http://ia.media-imdb.com/images/M/MV5BMTM1MzY5NjExMV5BMl5BanBnXkFtZTcwNDkyNzEzMQ@@._V1_SX300.jpg;N/A;6,8;6,796;tt0079813;movie;;;
True;Children's Island;1980;N/A;25 Dec 1980;109 min;Drama;Kay Pollak;P.C. Jersild (book), Ola Olsson, Kay Pollak, Carl-Johan Seth;Tomas Fryk, Anita Ekström, Ingvar Hirdwall, Börje Ahlstedt;Reine is supposed to go to a summer camp called 'Childrens island' but decides to remain in Stockholm over the summer while his mother is working at a hospital. She thinks he is at the camp...;Swedish;Sweden;3 wins & 2 nominations.;http://ia.media-imdb.com/images/M/MV5BZTc2Y2FlMTktM2YyOS00NWJiLTllMjUtNTJiNGIyMjQzNGE5XkEyXkFqcGdeQXVyNjQ4OTc3MTI@._V1_SX300.jpg;N/A;6,7;585;tt0080419;movie;;;
True;Devil Hunter;1980;NOT RATED;05 Dec 1980;102 min;Horror;Jesús Franco;Julián Esteban (story), Julián Esteban (screenplay), Jesús Franco (screenplay);Ursula Buchfellner, Al Cliver, Antonio Mayans, Antonio de Cabo;A Vietnam veteran heads to an island inhabited by cannibals to save a kidnapped model not only from her kidnappers, but also from the cannibals' lurking Devil god.;Spanish;Spain, France, West Germany;N/A;http://ia.media-imdb.com/images/M/MV5BMTI0ODM0NzI5M15BMl5BanBnXkFtZTcwOTk0MDY5MQ@@._V1_SX300.jpg;N/A;3,3;800;tt0080486;movie;;;
True;Cheech and Chong's Next Movie;1980;R;18 Jul 1980;99 min;Comedy, Crime, Sci-Fi;Tommy Chong;Tommy Chong, Cheech Marin;Cheech Marin, Tommy Chong, Evelyn Guerrero, Betty Kennedy;The two stoners and their friends go through another series of crazy, drug-influenced misadventures.;English;USA;1 nomination.;http://ia.media-imdb.com/images/M/MV5BMTMxOTk2MzYxOV5BMl5BanBnXkFtZTcwMDMyOTQyMQ@@._V1_SX300.jpg;N/A;6,1;8,777;tt0080520;movie;;;
True;The Day Christ Died;1980;N/A;26 Mar 1980;142 min;Drama;James Cellan Jones;Edward Anhalt, James Lee Barrett, Jim Bishop (book);Chris Sarandon, Colin Blakely, Keith Michell, Jonathan Pryce;The Crucifixion of Christ seen more from a political and historical point of view than a spiritual one.;English;USA;N/A;N/A;N/A;7,1;78;tt0080595;movie;;;
True;The Day Time Ended;1979;PG;31 Jul 1981;79 min;Sci-Fi;John 'Bud' Cardos;Wayne Schmidt (screenplay), J. Larry Carroll (screenplay), David Schmoeller (screenplay), Steve Neill (original story);Jim Davis, Christopher Mitchum, Dorothy Malone, Marcy Lafferty;Aliens visit the solar-powered house of a middle-class family, and the house is suddenly sucked into a time warp that transports it back to prehistoric times.;English;USA;1 nomination.;http://ia.media-imdb.com/images/M/MV5BODMyNDU4OTU4Nl5BMl5BanBnXkFtZTcwMzg2MjA0MQ@@._V1_SX300.jpg;N/A;4,2;678;tt0080596;movie;;;
True;Foxes;1980;R;29 Feb 1980;106 min;Drama;Adrian Lyne;Gerald Ayres;Jodie Foster, Cherie Currie, Marilyn Kagan, Kandice Stroh;A group of four teenage girls come of age in the asphalt desert of Los Angeles' San Fernando Valley arranged with a blazing soundtrack and endless drinking, drugs and sex.;English;USA;2 nominations.;http://ia.media-imdb.com/images/M/MV5BMTM5MDg0ODg1M15BMl5BanBnXkFtZTcwOTIyMDgzNA@@._V1_SX300.jpg;N/A;6,1;2,989;tt0080756;movie;;;
True;Heaven's Gate;1980;R;19 Nov 1980;325 min;Adventure, Drama, Western;Michael Cimino;Michael Cimino;Kris Kristofferson, Christopher Walken, John Hurt, Sam Waterston;A dramatization of the real-life Johnson County War in 1890 Wyoming, in which a sheriff born into wealth attempts to protect immigrant farmers from rich cattle interests.;English, Russian, French, Polish, German;USA;Nominated for 1 Oscar. Another 2 wins & 8 nominations.;http://ia.media-imdb.com/images/M/MV5BMjAxNDE5MzQ5M15BMl5BanBnXkFtZTcwNTk3MTE3NA@@._V1_SX300.jpg;N/A;6,7;9,324;tt0080855;movie;;;
True;The Man with Bogart's Face;1980;PG;28 May 1980;106 min;Comedy;Robert Day;Andrew J. Fenady (novel), Andrew J. Fenady (screenplay);Robert Sacchi, Franco Nero, Michelle Phillips, Olivia Hussey;A man with a fixation on Humphrey Bogart gets plastic surgery to make him look exactly like Bogart. Then he changes his name to Sam Marlowe (after Sam Spade and Phillip Marlowe, two of ...;English;USA;1 win & 2 nominations.;http://ia.media-imdb.com/images/M/MV5BNTE1MTUxOTI4N15BMl5BanBnXkFtZTcwNzU5MjEzMQ@@._V1_SX300.jpg;N/A;6,4;378;tt0081110;movie;;;
True;The Return;1980;N/A;N/A;91 min;Sci-Fi, Mystery, Thriller;Greydon Clark;Ken Wheat, Jim Wheat, Curtis Burch;Jan-Michael Vincent, Cybill Shepherd, Martin Landau, Raymond Burr;Two young children and an adult in a small town have an encounter with an alien spaceship. 25 years later the children are reunited as adults in the same town which is now beset by strange ...;English;USA;N/A;http://ia.media-imdb.com/images/M/MV5BMTk1NzY2OTQ3M15BMl5BanBnXkFtZTgwNjUxMzQ5NzE@._V1_SX300.jpg;N/A;3,1;272;tt0081421;movie;;;
True;Screamers;1979;R;26 Jun 1981;81 min;Action, Horror;Sergio Martino;Cesare Frugoni (story), Luciano Martino (story), Sergio Donati (screenplay), Cesare Frugoni (screenplay), Sergio Martino (screenplay);Barbara Bach, Claudio Cassinelli, Richard Johnson, Beryl Cunningham;Aquatic creatures threaten the existence of a mysterious island.;Italian;Italy;N/A;http://ia.media-imdb.com/images/M/MV5BMTk4NjIzMTI5Ml5BMl5BanBnXkFtZTYwODk1Mjg5._V1_SX300.jpg;N/A;4,9;913;tt0081467;movie;;;
True;The Shining;1980;R;23 May 1980;146 min;Drama, Horror;Stanley Kubrick;Stephen King (novel), Stanley Kubrick (screenplay), Diane Johnson (screenplay);Jack Nicholson, Shelley Duvall, Danny Lloyd, Scatman Crothers;A family heads to an isolated hotel for the winter where an evil and spiritual presence influences the father into violence, while his psychic son sees horrific forebodings from the past and of the future.;English;USA, UK;3 wins & 5 nominations.;http://ia.media-imdb.com/images/M/MV5BODMxMjE3NTA4Ml5BMl5BanBnXkFtZTgwNDc0NTIxMDE@._V1_SX300.jpg;61;8,4;584,323;tt0081505;movie;;;
True;The Tempest;1979;R;25 Dec 1980;95 min;Drama;Derek Jarman;Derek Jarman, William Shakespeare (play);Peter Bull, David Meyer, Neil Cunningham, Heathcote Williams;Prospero, a potent magician, lives on a desolate isle with his virginal daughter, Miranda. He's in exile, banished from his duchy by his usurping brother and the King of Naples. Providence ...;English;UK;N/A;http://ia.media-imdb.com/images/M/MV5BMTYyNTgxMjA2MF5BMl5BanBnXkFtZTYwMjE5NjI5._V1_SX300.jpg;N/A;6,6;651;tt0081613;movie;;;
True;Up the Academy;1980;R;06 Jun 1980;87 min;Comedy;Robert Downey Sr.;Tom Patchett, Jay Tarses;Wendell Brown, Tommy Citera, Hutch Parker, Ralph Macchio;This puber-comedy is a kind of mixture between 'Animal House' and 'Police Academy'. Four boys are sent, for different reasons, to a the Sheldon R. Wienberg military academy. The life of ...;English;USA;3 nominations.;http://ia.media-imdb.com/images/M/MV5BMTY1MzY1MzEzOF5BMl5BanBnXkFtZTcwNjQwNjIzMQ@@._V1_SX300.jpg;N/A;4,6;1,248;tt0081695;movie;;;
True;Urban Cowboy;1980;PG;06 Jun 1980;132 min;Drama, Romance, Western;James Bridges;Aaron Latham (story), James Bridges (screenplay), Aaron Latham (screenplay);John Travolta, Debra Winger, Scott Glenn, Madolyn Smith Osborne;Bud is a young man from the country who learns about life and love in a Houston bar.;English;USA;Nominated for 2 Golden Globes. Another 4 nominations.;http://ia.media-imdb.com/images/M/MV5BMTM5OTk1NjkwMV5BMl5BanBnXkFtZTgwMzg0MjEyMDE@._V1_SX300.jpg;N/A;6,2;9,810;tt0081696;movie;;;
True;Arthur;1981;PG;17 Jul 1981;97 min;Comedy, Romance;Steve Gordon;Steve Gordon;Dudley Moore, Liza Minnelli, John Gielgud, Geraldine Fitzgerald;Arthur is a happy drunk with no pretensions at any ambition. He is also the heir to a vast fortune which he is told will only be his if he marries Susan. He does not love Susan, but she ...;English;USA;Won 2 Oscars. Another 9 wins & 6 nominations.;http://ia.media-imdb.com/images/M/MV5BMTI0OTI2Mjg2OF5BMl5BanBnXkFtZTYwNzk0NDI5._V1_SX300.jpg;N/A;6,9;20,880;tt0082031;movie;;;
True;Bloody Birthday;1981;R;28 Apr 1981;85 min;Horror;Ed Hunt;Ed Hunt (screenplay), Barry Pearson (screenplay);Lori Lethin, Melinda Cordell, Julie Brown, Joe Penny;Lacking consciences because they were born during a solar eclipse, a trio of 10-year-olds embark on an indiscriminate killing spree.;English;USA;N/A;http://ia.media-imdb.com/images/M/MV5BODI3NGZiODUtNjEyMS00ZTNkLTg5NmMtMjBjNWI5MDA3N2U4XkEyXkFqcGdeQXVyMTQxNzMzNDI@._V1_SX300.jpg;N/A;5,7;2,542;tt0082084;movie;;;
True;The Dorm That Dripped Blood;1982;R;02 Apr 1982;88 min;Horror;Stephen Carpenter, Jeffrey Obrow;Stephen Carpenter (screenplay), Jeffrey Obrow (screenplay), Stacey Giachino (screenplay);Laurie Lapinski, Stephen Sachs, David Snow, Pamela Holland;Joanne, Patty, Brian, and Craig prepare the old dorm building to be torn down. They are pursued by a serial killer with a wide range of murder methods, ranging from power drill to ...;English;USA;N/A;http://ia.media-imdb.com/images/M/MV5BMTc5OTI3MjI0OF5BMl5BanBnXkFtZTgwMTc3MjQzNTE@._V1_SX300.jpg;N/A;4,9;960;tt0082279;movie;;;
True;Heartbeeps;1981;PG;18 Dec 1981;78 min;Sci-Fi, Comedy;Allan Arkush;John Hill;Andy Kaufman, Bernadette Peters, Randy Quaid, Kenneth McMillan;Two household robots run away and try to start a family.;English;USA;Nominated for 1 Oscar. Another 8 nominations.;http://ia.media-imdb.com/images/M/MV5BMjI2Mjk2MjYzMV5BMl5BanBnXkFtZTYwMzczNjg5._V1_SX300.jpg;N/A;4,2;1,017;tt0082507;movie;;;
True;Heartland;1979;PG;22 Sep 1979;96 min;Western, Drama;Richard Pearce;Beth Ferris (screenplay), William Kittredge (additional scenes and dialogue);Rip Torn, Conchata Ferrell, Barry Primus, Megan Folsom;A widow with a young daughter travels to a ranch in Wyoming to manage the household of a rancher. After a while the man and woman develop a relationship that leads to a marriage. But life in the harsh place takes its toll.;English;USA;4 wins.;http://ia.media-imdb.com/images/M/MV5BMTI2MjU5NDgwM15BMl5BanBnXkFtZTcwMjcxNjAyMQ@@._V1_SX300.jpg;N/A;7,4;671;tt0082508;movie;;;
True;Honky Tonk Freeway;1981;PG;21 Aug 1981;107 min;Action, Comedy;John Schlesinger;Edward Clinton;David Rasche, Paul Jabara, Howard Hesseman, Teri Garr;Ticlaw, a small town in Florida, has only one attraction: a safari park. The government constructs a freeway that passes near Ticlaw, but decides not to put an exit into the town. The ...;English;USA, UK;4 nominations.;http://ia.media-imdb.com/images/M/MV5BNjk0MTA2MTA3MV5BMl5BanBnXkFtZTcwMjQ1MTQyMQ@@._V1_SX300.jpg;N/A;5;696;tt0082525;movie;;;
True;Just Before Dawn;1981;R;14 Oct 1981;90 min;Horror, Thriller;Jeff Lieberman;Mark Arywitz (screenplay), Jeff Lieberman (screenplay), Jonas Middleton (story);George Kennedy, Mike Kellin, Chris Lemmon, Gregg Henry;Five campers arrive in the mountains to examine some property they have bought, but are warned by the forest ranger Roy McLean that a huge machete-wielding maniac has been terrorising the ...;English;USA;N/A;http://ia.media-imdb.com/images/M/MV5BMTQ5MDY4MzM3Nl5BMl5BanBnXkFtZTgwNDQ5MjkwMzE@._V1_SX300.jpg;N/A;6,4;3,056;tt0082592;movie;;;
True;The Munsters' Revenge;1981;N/A;27 Feb 1981;96 min;Comedy, Sci-Fi;Don Weis;Norm Liebmann (characters), Ed Haas (characters), Allan Burns (format), Chris Hayward (format), Arthur Alsberg, Don Nelson;Fred Gwynne, Al Lewis, Yvonne De Carlo, K.C. Martel;When a wax museum owner attempts to frame the Munsters for pulling a jewelry heist, they must both prove their innocence and find out the true thieves.;English;USA;N/A;http://ia.media-imdb.com/images/M/MV5BMjA1ODIzODk5M15BMl5BanBnXkFtZTcwMjgyNjEyMQ@@._V1_SX300.jpg;N/A;6,2;509;tt0082778;movie;;;
True;They All Laughed;1981;PG;14 Aug 1981;115 min;Comedy, Romance;Peter Bogdanovich;Peter Bogdanovich, Blaine Novak;Audrey Hepburn, Ben Gazzara, Patti Hansen, John Ritter;A mad cap private-eye caper about a team of detectives who are following, and are being followed by, a group of beautiful women.;English;USA;1 win.;http://ia.media-imdb.com/images/M/MV5BMjA5ODMxMTc1Nl5BMl5BanBnXkFtZTcwMjY3MTQyMQ@@._V1_SX300.jpg;N/A;6,4;1,496;tt0083189;movie;;;
True;Police Squad!;1982;TV-PG;04 Mar 1982;149 min;Comedy, Crime;N/A;Jim Abrahams, David Zucker, Jerry Zucker;Leslie Nielsen, Alan North, Rex Hamilton, Ed Williams;"Sight-gags and non-sequiturs dominate this spoof of police dramas. The six episodes formed the basis for later very successful &quot;Naked Gun&quot; movies.";English;USA;Nominated for 2 Primetime Emmys. Another 1 win & 1 nomination.;http://ia.media-imdb.com/images/M/MV5BMTg5NDQ4MTg1OV5BMl5BanBnXkFtZTcwMzI3OTczMQ@@._V1_SX300.jpg;N/A;8,5;9,184;tt0083466;series;;;
True;Scooby-Doo and Scrappy-Doo;1979–2010;TV-G;22 Sep 1979;30 min;Animation, Comedy, Mystery;N/A;N/A;Casey Kasem, Don Messick, Heather North, Lennie Weinrib;An updated version of the classic Hanna-Barbera mystery cartoon. Fred, Daphne, Velma, Shaggy and Scooby-Doo travel from town to town in their van, The Mystery Machine, solving cases of ...;English;USA;N/A;http://ia.media-imdb.com/images/M/MV5BMTk3NTgyMTYxOF5BMl5BanBnXkFtZTgwMTI0MzkwMzE@._V1_SX300.jpg;N/A;6,3;1,811;tt0083475;series;;;
True;Alley Cat;1984;R;01 Mar 1984;82 min;Action;Victor M. Ordonez, Ed Palmos, Al Valletta;Robert E. Waters (screenplay);Karin Mani, Robert Torti, Britt Helfer, Michael Wayne;A beautiful young martial arts expert stops a vicious street gang from robbing her grandparents' house. The gang marks her for murder, but her grandparents are killed instead. The girl sets out to take her revenge on the gang.;English;USA;N/A;http://ia.media-imdb.com/images/M/MV5BMzQxNjMyODU5OV5BMl5BanBnXkFtZTcwNTUxMDcxMQ@@._V1_SX300.jpg;N/A;5,8;171;tt0083541;movie;;;
True;Frightmare;1983;R;01 Sep 1983;86 min;Horror;Norman Thaddeus Vane;Norman Thaddeus Vane (screenplay);Ferdy Mayne, Luca Bercovici, Nita Talbot, Leon Askin;Drama students decide to pay tribute to their favorite horror star by stealing his body from his crypt for a farewell party. They fail to realize their violation of the tomb has triggered ...;English;USA;N/A;http://ia.media-imdb.com/images/M/MV5BMjE3MDI3NTI0NF5BMl5BanBnXkFtZTYwNzM2Mjg5._V1_SX300.jpg;N/A;4,1;488;tt0083973;movie;;;
True;Jekyll and Hyde... Together Again;1982;R;25 Feb 1983;87 min;Sci-Fi, Comedy, Music;Jerry Belson;Monica Mcgowan Johnson, Harvey Miller, Jerry Belson, Michael Leeson, Robert Louis Stevenson (novel);Mark Blankfield, Bess Armstrong, Krista Errickson, Tim Thomerson;Dr Daniel Jekyll researching into drugs that would help mankind avoid surgery discovers a white powder that unleashes the animal in every man, and in his case turning him from a shy and ...;English;USA;N/A;http://ia.media-imdb.com/images/M/MV5BMTY3NDM2OTU0MV5BMl5BanBnXkFtZTYwMzU5Njg5._V1_SX300.jpg;N/A;6,2;863;tt0084171;movie;;;
True;Dragon Strike;1982;PG-13;21 Jan 1982;102 min;Action, Comedy, Sport;Jackie Chan;Jackie Chan, Jack Maeby (english adaptation), Edward Tang, Barry Wong;Jackie Chan, Mars, Wai-Man Chan, Shirley Yim;The adventures of a restless martial arts student called Dragon, who, while constantly pursuing a girl, gets involved in the affairs of a gang of thieves.;Cantonese, English;Hong Kong;1 nomination.;http://ia.media-imdb.com/images/M/MV5BMTQ2MTEyNjcwMF5BMl5BanBnXkFtZTcwNjk4NzkxMQ@@._V1_SX300.jpg;N/A;6,6;2,372;tt0084266;movie;;;
True;Class Reunion;1982;R;29 Oct 1982;84 min;Comedy, Horror;Michael Miller;John Hughes;Gerrit Graham, Michael Lerner, Misty Rowe, Blackie Dammett;Lizzie Borden High's class of '72 are going through the motions at their tenth-year reunion, until deranged alum Walter Baylor, driven insane by a sadistic senior-year prank, escapes from ...;English;USA;N/A;http://ia.media-imdb.com/images/M/MV5BMTIwNDg1ODU0OV5BMl5BanBnXkFtZTcwOTA0NDEzMQ@@._V1_SX300.jpg;N/A;4,6;1,539;tt0084395;movie;;;
True;The Return of the Soldier;1982;PG;14 Feb 1985;99 min;Drama;Alan Bridges;Rebecca West (novel), Hugh Whitemore;Julie Christie, Glenda Jackson, Ann-Margret, Alan Bates;Kitty Baldry (Julie Chirstie) is a haughty society queen with a tunneled view of life. Kitty's complacency is rocked when her husband, Captain Chris Baldry (Alan Bates), returns from the ...;English;UK;Nominated for 1 BAFTA Film Award. Another 1 nomination.;N/A;N/A;7;299;tt0084590;movie;;;
True;Sweeney Todd: The Demon Barber of Fleet Street;1982;N/A;12 Sep 1982;140 min;Musical, Drama, Thriller;Terry Hughes, Harold Prince;Hugh Wheeler (book), Christopher Bond (based upon the play by);Angela Lansbury, George Hearn, Cris Groenendaal, Sara Woods;Sweeney Todd returns to London to uncover the past, along the way meeting Mrs. Lovett, and begins to start his life of crime.;English;USA;Won 3 Primetime Emmys. Another 4 wins & 2 nominations.;http://ia.media-imdb.com/images/M/MV5BMjA1MzYwMjk1Nl5BMl5BanBnXkFtZTcwMzg3MDUyMQ@@._V1_SX300.jpg;N/A;8,5;2,895;tt0084747;movie;;;
True;After MASH;1983–1985;N/A;26 Sep 1983;30 min;Comedy;N/A;Larry Gelbart;Harry Morgan, Jamie Farr, William Christopher, Rosalind Chao;The Korean War has ended. Colonel Potter, Sergeant Klinger, and Father Mulcahy find themselves together once again, this time at a veteran's hospital.;English;USA;Nominated for 1 Primetime Emmy. Another 1 nomination.;http://ia.media-imdb.com/images/M/MV5BZGI4YjkyZTgtODdlMS00OWVjLTk3ZDYtYzI1ODgyM2QwM2MzXkEyXkFqcGdeQXVyNjExODE1MDc@._V1_SX300.jpg;N/A;5,7;332;tt0084969;series;;;
True;Le Dernier Combat (The Last Battle);1983;R;12 Jun 1984;92 min;Sci-Fi;Luc Besson;Luc Besson, Pierre Jolivet;Pierre Jolivet, Jean Bouise, Fritz Wepper, Jean Reno;"In the post-apocalyptic future, only a few humans are left. No one is able to speak; the film contains no dialogue, and characters communicate non-verbally. A determined loner befriends a ...";N/A;France;8 wins & 3 nominations.;http://ia.media-imdb.com/images/M/MV5BMTg4OTg5NTM0N15BMl5BanBnXkFtZTcwMTEyOTQyMQ@@._V1_SX300.jpg;N/A;6,9;4,261;tt0085426;movie;;;
True;The Dresser;1983;PG;06 Dec 1983;118 min;Drama;Peter Yates;Ronald Harwood (screenplay);Albert Finney, Tom Courtenay, Edward Fox, Zena Walker;An effeminate personal assistant of a deteriorating veteran actor struggles to get him through a difficult performance of King Lear.;English;UK;Nominated for 5 Oscars. Another 5 wins & 12 nominations.;http://ia.media-imdb.com/images/M/MV5BMTk3ODI4NzQzNF5BMl5BanBnXkFtZTcwMTEzNDYyMQ@@._V1_SX300.jpg;N/A;7,7;3,540;tt0085461;movie;;;
True;Eddie Murphy: Delirious;1983;NOT RATED;17 Aug 1983;69 min;Documentary, Comedy;Bruce Gowers;Eddie Murphy;Eddie Murphy, James Argiro;Eddie Murphy's raunchy, raucous stand-up comedy routine is captured for posterity on this tape. Not for folks who dislike foul language.;English;USA;N/A;http://ia.media-imdb.com/images/M/MV5BMTQ5MDcyODU0Nl5BMl5BanBnXkFtZTcwMTgxNjA0MQ@@._V1_SX300.jpg;N/A;8,3;11,496;tt0085474;movie;;;
True;Going Berserk;1983;R;30 Sep 1983;85 min;Comedy;David Steinberg;Dana Olsen, David Steinberg;John Candy, Joe Flaherty, Eugene Levy, Alley Mills;A drummer/chauffeur engaged to a congressman's daughter encounters a sleazy film director, the leader of an aerobics cult, and other crazed characters during the days leading up to his wedding.;English;Canada, USA;N/A;http://ia.media-imdb.com/images/M/MV5BMTM3MTgzNDI2NF5BMl5BanBnXkFtZTYwNjY2Mjg5._V1_SX300.jpg;N/A;5,3;1,227;tt0085603;movie;;;
True;Packin' It In;1983;UNRATED;07 Feb 1983;95 min;Comedy, Drama, Family;Jud Taylor;Patricia Jones, Donald Reiker;Richard Benjamin, Paula Prentiss, Tony Roberts, Andrea Marcovicci;In quest of a wholesome place to live: at first the Webbers laugh at their neighbors when they leave L.A. for the mountains of Oregon. But when they recognize the same symptoms in their ...;English;USA;N/A;http://ia.media-imdb.com/images/M/MV5BMTY5NTAzMTc5MV5BMl5BanBnXkFtZTcwMDY0MTEzMQ@@._V1_SX300.jpg;N/A;5,7;125;tt0086071;movie;;;
